{
  "batch_id": "batch_demo_001",
  "tenant_id": "demo_store",
  "source": "mock_connector",
  "source_version": "v1.0",
  "upserts": [
    {
      "product_id": "prod_lap_01",
      "variant_id": "v1-001",
      "sku": "APX-PRO-14",
      "title": "UltraBook Pro 14 / ألترا بوك برو ١٤",
      "category": "laptops",
      "brand": "Apex",
      "published": true,
      "currency": "USD",
      "price_minor": 129900,
      "inventory_status": "in_stock",
      "attributes": {
        "weight_g": 1200,
        "battery_wh": 65,
        "usb_c_pd": true
      },
      "source_updated_at": "2026-09-26T10:00:00Z"
    },
    {
      "product_id": "prod_lap_02",
      "variant_id": "v1-002",
      "sku": "APX-SLM-13",
      "title": "Apex Slim 13 / أيبكس سليم ١٣",
      "category": "laptops",
      "brand": "Apex",
      "published": true,
      "currency": "USD",
      "price_minor": 99900,
      "inventory_status": "in_stock",
      "attributes": {
        "weight_g": 1100,
        "battery_wh": 50,
        "usb_c_pd": true
      },
      "source_updated_at": "2026-09-26T10:00:00Z"
    },
    {
      "product_id": "prod_lap_03",
      "variant_id": "v1-003",
      "sku": "NOV-AIR-13",
      "title": "Nova Book Air / نوفا بوك إير",
      "category": "laptops",
      "brand": "Nova",
      "published": true,
      "currency": "USD",
      "price_minor": 115000,
      "inventory_status": "out_of_stock",
      "attributes": {
        "weight_g": 1250,
        "battery_wh": 55,
        "usb_c_pd": true
      },
      "source_updated_at": "2026-09-26T10:00:00Z"
    },
    {
      "product_id": "prod_lap_04",
      "variant_id": "v1-004",
      "sku": "NOV-WRK-16",
      "title": "Nova Workstation 16 / نوفا محطة عمل",
      "category": "laptops",
      "brand": "Nova",
      "published": true,
      "currency": "USD",
      "price_minor": 219900,
      "inventory_status": "in_stock",
      "attributes": {
        "weight_g": 1950,
        "battery_wh": 90,
        "usb_c_pd": true
      },
      "source_updated_at": "2026-09-26T10:00:00Z"
    },
    {
      "product_id": "prod_lap_05",
      "variant_id": "v1-005",
      "sku": "TTN-GAM-15",
      "title": "Titan Gaming 15 / تيتان ألعاب",
      "category": "laptops",
      "brand": "Titan",
      "published": true,
      "currency": "USD",
      "price_minor": 159900,
      "inventory_status": "in_stock",
      "attributes": {
        "weight_g": 2200,
        "battery_wh": 80,
        "usb_c_pd": false
      },
      "source_updated_at": "2026-09-26T10:00:00Z"
    },
    {
      "product_id": "prod_lap_06",
      "variant_id": "v1-006",
      "sku": "TTN-CRT-16",
      "title": "Titan Creator 16 / تيتان للمبدعين",
      "category": "laptops",
      "brand": "Titan",
      "published": true,
      "currency": "USD",
      "price_minor": 239900,
      "inventory_status": "in_stock",
      "attributes": {
        "weight_g": 1900,
        "battery_wh": 88,
        "usb_c_pd": true
      },
      "source_updated_at": "2026-09-26T10:00:00Z"
    },
    {
      "product_id": "prod_acc_01",
      "variant_id": "v1-007",
      "sku": "APX-GAN-65",
      "title": "USB-C GaN Fast Charger 65W / شاحن سريع",
      "category": "accessories",
      "brand": "Apex",
      "published": true,
      "currency": "USD",
      "price_minor": 4900,
      "inventory_status": "in_stock",
      "attributes": {
        "watts": 65
      },
      "source_updated_at": "2026-09-26T10:00:00Z"
    },
    {
      "product_id": "prod_acc_02",
      "variant_id": "v1-008",
      "sku": "APX-MSE-WL",
      "title": "Wireless Precision Mouse / ماوس لاسلكي",
      "category": "accessories",
      "brand": "Apex",
      "published": true,
      "currency": "USD",
      "price_minor": 3500,
      "inventory_status": "in_stock",
      "attributes": {
        "dpi": 4000
      },
      "source_updated_at": "2026-09-26T10:00:00Z"
    },
    {
      "product_id": "prod_acc_03",
      "variant_id": "v1-009",
      "sku": "NOV-SLV-14",
      "title": "Laptop Sleeve 14-inch / حافظة حاسوب",
      "category": "accessories",
      "brand": "Nova",
      "published": true,
      "currency": "USD",
      "price_minor": 2900,
      "inventory_status": "in_stock",
      "attributes": {
        "material": "neoprene"
      },
      "source_updated_at": "2026-09-26T10:00:00Z"
    },
    {
      "product_id": "prod_mon_01",
      "variant_id": "v1-010",
      "sku": "VIS-4K-27",
      "title": "Vision 27 4K IPS Display / شاشة فيجن ٢٧",
      "category": "monitors",
      "brand": "Vision",
      "published": true,
      "currency": "USD",
      "price_minor": 39900,
      "inventory_status": "in_stock",
      "attributes": {
        "resolution": "4K"
      },
      "source_updated_at": "2026-09-26T10:00:00Z"
    },
    {
      "product_id": "prod_mon_02",
      "variant_id": "v1-011",
      "sku": "VIS-CRV-34",
      "title": "Vision 34 Ultrawide Curved / شاشة منحنية",
      "category": "monitors",
      "brand": "Vision",
      "published": true,
      "currency": "USD",
      "price_minor": 54900,
      "inventory_status": "in_stock",
      "attributes": {
        "aspect_ratio": "21:9"
      },
      "source_updated_at": "2026-09-26T10:00:00Z"
    },
    {
      "product_id": "prod_lap_07",
      "variant_id": "v1-012",
      "sku": "APX-STU-11",
      "title": "Apex Student 11 / أيبكس للطلاب",
      "category": "laptops",
      "brand": "Apex",
      "published": true,
      "currency": "USD",
      "price_minor": 49900,
      "inventory_status": "in_stock",
      "attributes": {
        "weight_g": 980,
        "battery_wh": 42,
        "usb_c_pd": true
      },
      "source_updated_at": "2026-09-26T10:00:00Z"
    }
  ],
  "deletes": []
}
